{
  "schema_version": "1.0.0",
  "id": "3f1c2a9e-5b7d-4c1e-9a0b-8d6f4e2c1a00",
  "parent_id": null,
  "created_at": "2026-10-25T12:00:00+00:00",
  "angle_convention": "atan2_dy_dx_counts_rad",
  "mapping": {
    "dpi": 800,
    "yaw_deg_per_count": 0.022,
    "pitch_deg_per_count": 0.022,
    "cm_per_360": 51.95,
    "fov_h_deg": 103.0
  },
  "model": {
    "type": "fourier",
    "quantity": "relative_along_bias",
    "link": "inverse_one_plus",
    "order": 4,
    "coeffs": [
      -0.01752188748823236,
      0.024779453417662616,
      -0.026621211740676717,
      0.015034821723195901,
      0.041521754416853365,
      -0.01916226337625381,
      0.011100649184892395,
      0.006043530090662317,
      0.01423364800897297
    ],
    "cov": [
      [
        1.3485594862015363e-05,
        6.188443662615328e-08,
        -5.8572573451608484e-08,
        8.23878696735382e-08,
        -7.992643038891975e-08,
        3.482148555611087e-08,
        -8.663651691751102e-09,
        7.475821446507813e-08,
        -3.179364127614114e-07
      ],
      [
        6.18844366261533e-08,
        2.7057991883940087e-05,
        -7.879979778774462e-08,
        9.629795114132542e-08,
        -5.825508396944576e-08,
        1.4938407145787309e-07,
        -4.1094314227902484e-07,
        3.942667472964968e-07,
        -2.2264906341805008e-07
      ],
      [
        -5.857257345160847e-08,
        -7.879979778774461e-08,
        2.688269386020122e-05,
        5.214988585395868e-08,
        1.6083693565723513e-08,
        -2.5039232913158147e-07,
        -3.8322441757345145e-09,
        -2.1502246602918378e-07,
        -3.1571927620780253e-07
      ],
      [
        8.23878696735382e-08,
        9.62979511413254e-08,
        5.214988585395867e-08,
        2.6999782436806345e-05,
        -3.328222050156993e-07,
        4.2162179102763633e-07,
        -2.7349790528753087e-07,
        -1.3623758301430946e-07,
        2.40019085111871e-07
      ],
      [
        -7.992643038891978e-08,
        -5.8255083969445756e-08,
        1.608369356572351e-08,
        -3.328222050156993e-07,
        2.684718874772091e-05,
        -1.7293330749450425e-07,
        -2.9955670435828543e-07,
        4.0896879740125435e-07,
        2.7122811423849866e-07
      ],
      [
        3.482148555611086e-08,
        1.4938407145787306e-07,
        -2.5039232913158147e-07,
        4.2162179102763654e-07,
        -1.7293330749450427e-07,
        2.6497740306123594e-05,
        3.2685009626890164e-07,
        -4.057718266181812e-07,
        1.1447298336315861e-07
      ],
      [
        -8.6636516917511e-09,
        -4.1094314227902495e-07,
        -3.832244175734512e-09,
        -2.734979052875309e-07,
        -2.9955670435828543e-07,
        3.2685009626890164e-07,
        2.6915533677593812e-05,
        2.186684294306733e-07,
        5.078624607380425e-07
      ],
      [
        7.475821446507813e-08,
        3.942667472964968e-07,
        -2.150224660291838e-07,
        -1.3623758301430948e-07,
        4.0896879740125435e-07,
        -4.057718266181812e-07,
        2.186684294306733e-07,
        2.659022788239596e-05,
        3.024403719546739e-08
      ],
      [
        -3.179364127614114e-07,
        -2.2264906341805008e-07,
        -3.1571927620780253e-07,
        2.40019085111871e-07,
        2.7122811423849866e-07,
        1.1447298336315861e-07,
        5.078624607380425e-07,
        3.024403719546739e-08,
        2.5660770901418874e-05
      ]
    ],
    "speed": null
  },
  "bounds": {
    "min_gain": 0.85,
    "max_gain": 1.15
  },
  "bins": [
    {
      "theta": 0.0,
      "gain": 0.9909097365677977,
      "ci_low": 0.9686407128825479,
      "ci_high": 1.011582205287466,
      "n": 10
    },
    {
      "theta": 0.09817477042468103,
      "gain": 0.9772391083233337,
      "ci_low": 0.957597827749637,
      "ci_high": 0.9975959191859078,
      "n": 13
    },
    {
      "theta": 0.19634954084936207,
      "gain": 0.9653064730156575,
      "ci_low": 0.9473838809143625,
      "ci_high": 0.9851412690129886,
      "n": 13
    },
    {
      "theta": 0.2945243112740431,
      "gain": 0.956096497380383,
      "ci_low": 0.9397467337750085,
      "ci_high": 0.9754926343434684,
      "n": 9
    },
    {
      "theta": 0.39269908169872414,
      "gain": 0.9502707954915142,
      "ci_low": 0.9333779020538504,
      "ci_high": 0.9699065740549961,
      "n": 11
    },
    {
      "theta": 0.4908738521234052,
      "gain": 0.9481676142622915,
      "ci_low": 0.933016478519802,
      "ci_high": 0.9678031363825751,
      "n": 13
    },
    {
      "theta": 0.5890486225480862,
      "gain": 0.9498270827900809,
      "ci_low": 0.932062894331725,
      "ci_high": 0.9724726371278437,
      "n": 17
    },
    {
      "theta": 0.6872233929727672,
      "gain": 0.9550295135761616,
      "ci_low": 0.9389311684673302,
      "ci_high": 0.974569372747217,
      "n": 7
    },
    {
      "theta": 0.7853981633974483,
      "gain": 0.9633418302855602,
      "ci_low": 0.944692626170958,
      "ci_high": 0.982445017138306,
      "n": 17
    },
    {
      "theta": 0.8835729338221293,
      "gain": 0.9741724705478051,
      "ci_low": 0.9530365383791936,
      "ci_high": 0.9936250944259083,
      "n": 12
    },
    {
      "theta": 0.9817477042468103,
      "gain": 0.9868363944939896,
      "ci_low": 0.9665068227209794,
      "ci_high": 1.00687005386549,
      "n": 10
    },
    {
      "theta": 1.0799224746714913,
      "gain": 1.000628961384009,
      "ci_low": 0.978032088956134,
      "ci_high": 1.0223783806664821,
      "n": 11
    },
    {
      "theta": 1.1780972450961724,
      "gain": 1.014901765837801,
      "ci_low": 0.9926378823550904,
      "ci_high": 1.0373739012726928,
      "n": 15
    },
    {
      "theta": 1.2762720155208536,
      "gain": 1.0291278314703929,
      "ci_low": 1.0091443032122918,
      "ci_high": 1.0506732522467939,
      "n": 11
    },
    {
      "theta": 1.3744467859455345,
      "gain": 1.042941208608247,
      "ci_low": 1.023348444254413,
      "ci_high": 1.0638453040890448,
      "n": 12
    },
    {
      "theta": 1.4726215563702154,
      "gain": 1.0561392665819742,
      "ci_low": 1.0361918672819865,
      "ci_high": 1.0770419875598405,
      "n": 8
    },
    {
      "theta": 1.5707963267948966,
      "gain": 1.0686444169158842,
      "ci_low": 1.0451645109276193,
      "ci_high": 1.0887580252417746,
      "n": 11
    },
    {
      "theta": 1.6689710972195777,
      "gain": 1.0804326365149632,
      "ci_low": 1.059639964507925,
      "ci_high": 1.100470027240436,
      "n": 16
    },
    {
      "theta": 1.7671458676442586,
      "gain": 1.0914451714919544,
      "ci_low": 1.0708025322647026,
      "ci_high": 1.1107498853072426,
      "n": 10
    },
    {
      "theta": 1.8653206380689396,
      "gain": 1.1015047837124599,
      "ci_low": 1.0800197989096412,
      "ci_high": 1.1241704351800066,
      "n": 19
    },
    {
      "theta": 1.9634954084936207,
      "gain": 1.1102585736452406,
      "ci_low": 1.0866112396195557,
      "ci_high": 1.134214642478696,
      "n": 9
    },
    {
      "theta": 2.061670178918302,
      "gain": 1.1171664744532026,
      "ci_low": 1.0903386735347373,
      "ci_high": 1.1423109014714035,
      "n": 12
    },
    {
      "theta": 2.1598449493429825,
      "gain": 1.1215479468959104,
      "ci_low": 1.093539054949522,
      "ci_high": 1.1477469440057684,
      "n": 14
    },
    {
      "theta": 2.2580197197676637,
      "gain": 1.122688102748081,
      "ci_low": 1.094192481732192,
      "ci_high": 1.1499306112221528,
      "n": 9
    },
    {
      "theta": 2.356194490192345,
      "gain": 1.1199880780657927,
      "ci_low": 1.0916653105959504,
      "ci_high": 1.1495972589587784,
      "n": 13
    },
    {
      "theta": 2.454369260617026,
      "gain": 1.1131263201734631,
      "ci_low": 1.084690453095502,
      "ci_high": 1.1436045489622275,
      "n": 10
    },
    {
      "theta": 2.552544031041707,
      "gain": 1.1021857014946228,
      "ci_low": 1.0752371353380206,
      "ci_high": 1.1316068468513647,
      "n": 10
    },
    {
      "theta": 2.650718801466388,
      "gain": 1.0877052087229795,
      "ci_low": 1.059319452013982,
      "ci_high": 1.1160788102254107,
      "n": 16
    },
    {
      "theta": 2.748893571891069,
      "gain": 1.0706369979977828,
      "ci_low": 1.0422899933909078,
      "ci_high": 1.098518904132264,
      "n": 11
    },
    {
      "theta": 2.84706834231575,
      "gain": 1.052221121202577,
      "ci_low": 1.0264429643320163,
      "ci_high": 1.0757238058980123,
      "n": 14
    },
    {
      "theta": 2.945243112740431,
      "gain": 1.0338154124037735,
      "ci_low": 1.011363471557462,
      "ci_high": 1.0599910825296157,
      "n": 10
    },
    {
      "theta": 3.043417883165112,
      "gain": 1.016725038548638,
      "ci_low": 0.9962880907080957,
      "ci_high": 1.0411916093874503,
      "n": 10
    },
    {
      "theta": 3.141592653589793,
      "gain": 1.0020649810753877,
      "ci_low": 0.9828183772875693,
      "ci_high": 1.026075797633853,
      "n": 15
    },
    {
      "theta": 3.2397674240144743,
      "gain": 0.9906688821958591,
      "ci_low": 0.9716199025693868,
      "ci_high": 1.0132403533975767,
      "n": 12
    },
    {
      "theta": 3.3379421944391554,
      "gain": 0.9830404280100201,
      "ci_low": 0.9641274749187081,
      "ci_high": 1.004730447430366,
      "n": 8
    },
    {
      "theta": 3.436116964863836,
      "gain": 0.9793349932470865,
      "ci_low": 0.9604297511058271,
      "ci_high": 1.0008652081712355,
      "n": 13
    },
    {
      "theta": 3.5342917352885173,
      "gain": 0.9793600035801029,
      "ci_low": 0.9604649740435072,
      "ci_high": 0.9989920675051039,
      "n": 16
    },
    {
      "theta": 3.6324665057131984,
      "gain": 0.9825893370295026,
      "ci_low": 0.9625068620170397,
      "ci_high": 0.9990961256737936,
      "n": 11
    },
    {
      "theta": 3.730641276137879,